{
  "catalog_id": "nibelis-rubrics-synthetic-v1",
  "version": "1.1.0",
  "scope": "Fixtures synthetiques LOT 4C pour modeliser des rubriques Nibelis sans bulletin reel",
  "fixture_type": "synthetic_example",
  "security_notice": "Exemple synthetique uniquement. Aucun bulletin reel, matricule, donnees bancaires, taux individuel, donnee de sante nominative ou information personnelle.",
  "rubrics": [
    {
      "rubric_id": "NIB_RUB_SALAIRE_BASE",
      "rubric_code": "BASE_SAL_SYN",
      "label": "Salaire de base synthetique",
      "normalized_label": "salaire_base_synthetique",
      "business_description": "Rubrique fictive representant la base de remuneration brute a rapprocher du contrat, du bulletin et de la periode.",
      "data_role": "controlled_data",
      "category": "base_salary",
      "sub_category": "salaire_base",
      "payroll_topic": ["salaire_base"],
      "calculation_family": "fixed_amount",
      "appears_on_payslip": true,
      "gross_impact": "positive",
      "affects_gross": true,
      "unit": "amount_eur",
      "amount_applicable": true,
      "rate_applicable": false,
      "base_applicable": true,
      "source_layer": "synthetic_fixture",
      "generic_source": "bulletin fictif et contrat fictif",
      "source_document": "Fixture synthetique LOT 4C - bulletin fictif",
      "source_reference": "fixture:nibelis:salaire-base",
      "effective_date": "2026-01-01",
      "end_date": null,
      "linked_rule_ids": [],
      "linked_variables": ["salaire_reference", "base_horaire", "periode"],
      "linked_kelio_counter_ids": [],
      "documents_to_check": ["bulletin fictif", "contrat fictif"],
      "frequent_anomalies": ["periode incomplete", "base horaire absente", "variation non expliquee"],
      "control_points": ["Verifier la periode", "Verifier la base contractuelle", "Comparer avec les absences ou entrees/sorties"],
      "synthetic_reading_examples": [
        {
          "label": "Lecture salaire de base fictif",
          "value": "BASE_SAL_SYN = montant fictif",
          "interpretation": "Exemple pedagogique: la variation d'un mois a l'autre doit etre rapprochee de la periode et des absences."
        }
      ],
      "calculation_allowed": false,
      "validation_status": "synthetic_example",
      "confidence": "low",
      "confidentiality": "internal",
      "anonymization_required": true,
      "synthetic_only": true,
      "notes": ["Aucune valeur reelle ni formule de salaire n'est fournie."]
    },
    {
      "rubric_id": "NIB_RUB_PRIME_ANCIENNETE",
      "rubric_code": "ANC_SYN",
      "label": "Prime d'anciennete synthetique",
      "normalized_label": "prime_anciennete_synthetique",
      "business_description": "Rubrique fictive representant une prime liee a l'anciennete, sans taux ni bareme reel.",
      "data_role": "controlled_data",
      "category": "premium",
      "sub_category": "anciennete",
      "payroll_topic": ["anciennete"],
      "calculation_family": "variable_amount",
      "appears_on_payslip": true,
      "gross_impact": "positive",
      "affects_gross": true,
      "unit": "amount_eur",
      "amount_applicable": true,
      "rate_applicable": true,
      "base_applicable": true,
      "source_layer": "synthetic_fixture",
      "generic_source": "bulletin fictif et anciennete fictive",
      "source_document": "Fixture synthetique LOT 4C - bulletin fictif",
      "source_reference": "fixture:nibelis:anciennete",
      "effective_date": "2026-01-01",
      "end_date": null,
      "linked_rule_ids": [],
      "linked_variables": ["anciennete", "salaire_reference"],
      "linked_kelio_counter_ids": [],
      "documents_to_check": ["bulletin fictif", "contrat fictif", "historique anciennete fictif"],
      "frequent_anomalies": ["anciennete non confirmee", "base de calcul inconnue", "taux absent"],
      "control_points": ["Verifier l'anciennete retenue", "Verifier la source du taux", "Ne pas conclure sans base applicable"],
      "synthetic_reading_examples": [
        {
          "label": "Prime anciennete fictive",
          "value": "ANC_SYN = montant fictif",
          "interpretation": "Exemple pedagogique: la rubrique signale un controle, pas une formule validee."
        }
      ],
      "calculation_allowed": false,
      "validation_status": "synthetic_example",
      "confidence": "low",
      "confidentiality": "internal",
      "anonymization_required": true,
      "synthetic_only": true,
      "notes": ["Aucune valeur ou taux INEOS n'est encode."]
    },
    {
      "rubric_id": "NIB_RUB_PRIME_POSTE_5X8",
      "rubric_code": "POSTE_5X8_SYN",
      "label": "Prime poste ou 5x8 synthetique",
      "normalized_label": "prime_poste_5x8_synthetique",
      "business_description": "Rubrique fictive liee au regime de travail poste ou 5x8, a rapprocher du planning et du statut de population.",
      "data_role": "controlled_data",
      "category": "premium",
      "sub_category": "prime_poste",
      "payroll_topic": ["prime_poste"],
      "calculation_family": "variable_amount",
      "appears_on_payslip": true,
      "gross_impact": "positive",
      "affects_gross": true,
      "unit": "amount_eur",
      "amount_applicable": true,
      "rate_applicable": false,
      "base_applicable": true,
      "source_layer": "synthetic_fixture",
      "generic_source": "bulletin fictif et planning fictif",
      "source_document": "Fixture synthetique LOT 4C - bulletin fictif",
      "source_reference": "fixture:nibelis:prime-poste",
      "effective_date": "2026-01-01",
      "end_date": null,
      "linked_rule_ids": ["PAY_HOLIDAY_POSTED_NORMAL_001"],
      "linked_variables": ["poste_planifie", "roulement_theorique", "population_salarie"],
      "linked_kelio_counter_ids": [],
      "documents_to_check": ["bulletin fictif", "planning fictif", "releve Kelio fictif"],
      "frequent_anomalies": ["population non confirmee", "planning absent", "prime presente sans regime explique"],
      "control_points": ["Verifier le regime 5x8", "Verifier la population", "Comparer avec le planning"],
      "synthetic_reading_examples": [
        {
          "label": "Prime poste fictive",
          "value": "POSTE_5X8_SYN = montant fictif",
          "interpretation": "Exemple pedagogique: la presence de la rubrique doit etre rapprochee du regime travaille."
        }
      ],
      "calculation_allowed": false,
      "validation_status": "synthetic_example",
      "confidence": "low",
      "confidentiality": "internal",
      "anonymization_required": true,
      "synthetic_only": true,
      "notes": ["Lien indicatif avec une regle jour ferie poste, sans creer de regle prime poste dediee."]
    },
    {
      "rubric_id": "NIB_RUB_HSUP_BASE",
      "rubric_code": "HS_BASE_SYN",
      "label": "Heures supplementaires synthetiques",
      "normalized_label": "heures_supplementaires_synthetiques",
      "business_description": "Rubrique fictive de paiement ou controle d'heures supplementaires, a rapprocher des heures validees Kelio.",
      "data_role": "controlled_data",
      "category": "overtime",
      "sub_category": "heures_supplementaires",
      "payroll_topic": ["heures_supplementaires"],
      "calculation_family": "time_based",
      "appears_on_payslip": true,
      "gross_impact": "positive",
      "affects_gross": true,
      "unit": "hours",
      "amount_applicable": true,
      "rate_applicable": true,
      "base_applicable": true,
      "source_layer": "synthetic_fixture",
      "generic_source": "bulletin fictif et releve Kelio fictif",
      "source_document": "Fixture synthetique LOT 4C - bulletin fictif",
      "source_reference": "fixture:nibelis:hs-base",
      "effective_date": "2026-01-01",
      "end_date": null,
      "linked_rule_ids": ["PAY_HSUP_TRANCHES_001"],
      "linked_variables": ["heures_validees", "semaine_ou_cycle", "base_horaire"],
      "linked_kelio_counter_ids": ["KELIO_HS_SYN"],
      "documents_to_check": ["bulletin fictif", "releve Kelio fictif", "planning fictif"],
      "frequent_anomalies": ["heures non validees", "cycle absent", "ecart bulletin/Kelio"],
      "control_points": ["Verifier HS_SYN", "Verifier la semaine ou le cycle", "Verifier la base horaire"],
      "synthetic_reading_examples": [
        {
          "label": "Heures sup fictives",
          "value": "HS_BASE_SYN = 4 heures",
          "interpretation": "Exemple pedagogique: la quantite doit etre rapprochee du compteur HS_SYN."
        }
      ],
      "calculation_allowed": false,
      "validation_status": "synthetic_example",
      "confidence": "low",
      "confidentiality": "internal",
      "anonymization_required": true,
      "synthetic_only": true,
      "notes": ["Aucune majoration reelle n'est calculee."]
    },
    {
      "rubric_id": "NIB_RUB_HSUP_MAJ",
      "rubric_code": "HS_MAJ_SYN",
      "label": "Majoration heures supplementaires synthetique",
      "normalized_label": "majoration_heures_supplementaires_synthetique",
      "business_description": "Rubrique fictive de majoration d'heures supplementaires, conservee pour les liens existants avec Kelio et les parametres.",
      "data_role": "controlled_data",
      "category": "overtime",
      "sub_category": "majoration_hsup",
      "payroll_topic": ["heures_supplementaires"],
      "calculation_family": "time_based",
      "appears_on_payslip": true,
      "gross_impact": "positive",
      "affects_gross": true,
      "unit": "amount_eur",
      "amount_applicable": true,
      "rate_applicable": true,
      "base_applicable": true,
      "source_layer": "synthetic_fixture",
      "generic_source": "bulletin fictif, releve Kelio fictif et parametre fictif",
      "source_document": "Fixture synthetique LOT 4C - bulletin fictif",
      "source_reference": "fixture:nibelis:hsup-majoration",
      "effective_date": "2026-01-01",
      "end_date": null,
      "linked_rule_ids": ["PAY_HSUP_TRANCHES_001"],